<XMLUser xmlns="https://cargoonline.ru"
         xmlns:xsi="http://www.w3.org/2001/XMLSchema-instance"
         xsi:schemaLocation="https://cargoonline.ru userSchema.xsd"
         code="U4" age="44" flag="superuser">

    <username>User4</username>
    <firstname>FirstName4</firstname>
    <lastname>LastName4</lastname>
    <birth>2002-11-24</birth>
    <address>
        <country>Russia</country>
        <city>St. Petersburg</city>
        <street>Mira</street>
    </address>
</XMLUser>