<XMLUser xmlns="https://cargoonline.ru"
         xmlns:xsi="http://www.w3.org/2001/XMLSchema-instance"
         xsi:schemaLocation="https://cargoonline.ru userSchema.xsd"
         code="U1" age="11" flag="active">

    <username>User1</username>
    <firstname>Имя1</firstname>
    <lastname>Фамилия1</lastname>
    <birth>2002-09-24</birth>
    <address>
        <country>Россия</country>
        <city>St. Petersburg</city>
        <street>Mira</street>
    </address>
</XMLUser>